"subject_id"	"subject_snippet"	"property"	"object_id"	"object_label"	"object_snippet"	"snippet"
"http://data.mimotext.uni-trier.de/entity/Q681"	"Meister’s"	"http://data.mimotext.uni-trier.de/entity/P38"	"http://data.mimotext.uni-trier.de/entity/Q3908"	"eloquent tone"	"ausführliche Besprechung"	"Was für uns die Korrespondenz Raynal’s, nicht minder aber auch die Grimm’s und Meister’s, ermüdend macht, ist die ausführliche Besprechung und Schilderung so vieler Schriften und Schriftsteller, die, schnell vergessen, heute nur noch für den Spezialforscher existieren."
"http://data.mimotext.uni-trier.de/entity/Q433"	"Grimm’s"	"http://data.mimotext.uni-trier.de/entity/P38"	"http://data.mimotext.uni-trier.de/entity/Q3908"	"eloquent tone"	"ausführliche Besprechung"	"Was für uns die Korrespondenz Raynal’s, nicht minder aber auch die Grimm’s und Meister’s, ermüdend macht, ist die ausführliche Besprechung und Schilderung so vieler Schriften und Schriftsteller, die, schnell vergessen, heute nur noch für den Spezialforscher existieren."
"http://data.mimotext.uni-trier.de/entity/Q433"	"Grimm"	"http://data.mimotext.uni-trier.de/entity/P38"	"http://data.mimotext.uni-trier.de/entity/Q3902"	"criticism"	"tadelt"	"Friedrich dem Grossen zu Liebe geht auch Grimm in seiner sonst der Politik vorsichtig abgewandten Korrespondenz näher’ auf die Ereignisse des siebenjährigen Krieges ein und tadelt mit rückhaltloser Schärfe die unnatürliche Allianz des Versailler Hofes mit dem habsburgischen Erbfeinde."
"http://data.mimotext.uni-trier.de/entity/Q981"	"Voltaire"	"http://data.mimotext.uni-trier.de/entity/P38"	"http://data.mimotext.uni-trier.de/entity/Q3906"	"satire"	"witziger"	"Als Dichter und namentlich als Schöpfer unvergleichlich witziger und fesselnder Romane und Novellen hätte Voltaire viel wärmere Anerkennung verdient, das über den Historiker und Philosophen gefällte Urteil mag im Lob und Tadel der Wahrheit nahe kommen."
"http://data.mimotext.uni-trier.de/entity/Q981"	"Voltaire"	"http://data.mimotext.uni-trier.de/entity/P38"	"http://data.mimotext.uni-trier.de/entity/Q3902"	"criticism"	"Lob und Tadel"	"Als Dichter und namentlich als Schöpfer unvergleichlich witziger und fesselnder Romane und Novellen hätte Voltaire viel wärmere Anerkennung verdient, das über den Historiker und Philosophen gefällte Urteil mag im Lob und Tadel der Wahrheit nahe kommen."
